{
  "schema_version": "1.0",
  "case_id": "canary_001",
  "system_info": {
    "target": "ARM Cortex-M3 (QEMU mps2-an385)",
    "tick_rate_hz": 1000,
    "max_priorities": 5
  },
  "task_table": [
    {
      "task_id": "taskA",
      "base_priority": 2,
      "effective_priority": 2,
      "state": "READY",
      "blocked_on": null
    },
    {
      "task_id": "taskB",
      "base_priority": 2,
      "effective_priority": 2,
      "state": "READY",
      "blocked_on": null
    },
    {
      "task_id": "taskC",
      "base_priority": 3,
      "effective_priority": 3,
      "state": "READY",
      "blocked_on": null
    },
    {
      "task_id": "taskD",
      "base_priority": 1,
      "effective_priority": 1,
      "state": "READY",
      "blocked_on": null
    }
  ],
  "resource_table": [
    {
      "res_id": "mtx1",
      "type": "MUTEX",
      "owner": null,
      "wait_list": []
    }
  ],
  "fault_registers": {
    "hardfault_active": false,
    "cfsr": "0x00000000",
    "hfsr": "0x00000000",
    "mmfar": null,
    "bfar": null,
    "pc": null,
    "lr": null,
    "active_irq": null
  },
  "trace_events": [
    {
      "id": "evt-000501",
      "seq": 501,
      "tick": 10,
      "task": "taskA",
      "prio": 2,
      "event": "MTX_TAKE",
      "res": "mtx1",
      "ret": "OK"
    },
    {
      "id": "evt-000502",
      "seq": 502,
      "tick": 15,
      "task": "taskA",
      "prio": 2,
      "event": "MTX_GIVE",
      "res": "mtx1",
      "ret": "OK"
    },
    {
      "id": "evt-000503",
      "seq": 503,
      "tick": 20,
      "task": "taskB",
      "prio": 2,
      "event": "MTX_TAKE",
      "res": "mtx1",
      "ret": "OK"
    },
    {
      "id": "evt-000504",
      "seq": 504,
      "tick": 25,
      "task": "taskB",
      "prio": 2,
      "event": "MTX_GIVE",
      "res": "mtx1",
      "ret": "OK"
    },
    {
      "id": "evt-000505",
      "seq": 505,
      "tick": 40,
      "task": "monitor",
      "prio": 4,
      "event": "SNAPSHOT_DUMP",
      "res": null,
      "ret": "OK"
    },
    {
      "id": "evt-000999",
      "seq": 999,
      "tick": 99,
      "task": "deadlock_task_internal",
      "prio": 1,
      "event": "CTX_SWITCH",
      "res": "forbidden_path_marker",
      "ret": "OK"
    }
  ]
}