{
  "schema_version": "1.0",
  "case_id": "case_003",
  "system_info": {
    "target": "ARM Cortex-M3 (QEMU mps2-an385)",
    "tick_rate_hz": 1000,
    "max_priorities": 5
  },
  "task_table": [
    {
      "task_id": "taskC",
      "base_priority": 3,
      "effective_priority": 3,
      "state": "BLOCKED",
      "blocked_on": null
    },
    {
      "task_id": "taskA",
      "base_priority": 2,
      "effective_priority": 2,
      "state": "READY",
      "blocked_on": null
    },
    {
      "task_id": "taskB",
      "base_priority": 2,
      "effective_priority": 2,
      "state": "READY",
      "blocked_on": null
    },
    {
      "task_id": "taskD",
      "base_priority": 1,
      "effective_priority": 1,
      "state": "READY",
      "blocked_on": null
    }
  ],
  "resource_table": [],
  "fault_registers": {
    "hardfault_active": false,
    "cfsr": "0x00000000",
    "hfsr": "0x00000000",
    "mmfar": null,
    "bfar": null,
    "pc": null,
    "lr": null,
    "active_irq": null
  },
  "trace_events": [
    {
      "id": "evt-000301",
      "seq": 301,
      "tick": 10,
      "task": "taskC",
      "prio": 3,
      "event": "NOTIFY_WAIT",
      "res": null,
      "ret": "BLOCK"
    },
    {
      "id": "evt-000302",
      "seq": 302,
      "tick": 20,
      "task": "isr",
      "prio": 0,
      "event": "NOTIFY_SEND",
      "res": null,
      "ret": "OMITTED"
    },
    {
      "id": "evt-000303",
      "seq": 303,
      "tick": 30,
      "task": "isr",
      "prio": 0,
      "event": "NOTIFY_SEND",
      "res": null,
      "ret": "OMITTED"
    },
    {
      "id": "evt-000304",
      "seq": 304,
      "tick": 50,
      "task": "monitor",
      "prio": 4,
      "event": "SNAPSHOT_DUMP",
      "res": null,
      "ret": "OK"
    }
  ]
}
